"sprint_number","sprint_name","sprint_goal","start_date","end_date","duration_days","total_story_points","estimated_hours","team_capacity_hours","capacity_utilization","task_count","epic_coverage","key_deliverables","demo_objectives","success_criteria","risk_factors","mitigation_strategies","dependencies_resolved","team_members","external_dependencies","integration_windows","review_schedule","retrospective_date","burndown_target"
"1","Sprint 1: Secure Foundation & Viewer Spike","Implement a secure, end-to-end user authentication system and de-risk the DICOM viewer.","2024-10-28","2024-11-08","10","29","81.2","240","34%","8","User Authentication & Authorization,Security & Compliance,DICOM Viewer & Image Manipulation","Functional login screen; Secure credential storage; Encrypted database connections; GPU rendering PoC.","Demonstrate successful user login; Show encrypted data in DB; Demonstrate working DirectX PoC.","User can log in; All security tasks pass integration tests; Feasibility of DirectX approach is confirmed.","RISK-001: Technical complexity of DirectX; RISK-002: Complexity of pgcrypto integration.","The spike (TASK-VIEW-001) is the primary mitigation for RISK-001; Allocate senior developer to pgcrypto task.","true","frontend.dev@company.com,backend.dev@company.com,graphics.dev@company.com,fullstack.dev@company.com","","Internal integration testing throughout the sprint.","Sprint review on 2024-11-08 at 2 PM","2024-11-08","Front-load spike task; aim for 50% completion by day 4."
"2","Sprint 2: Authorization & Core Admin","Implement Role-Based Access Control, foundational user management capabilities, and core viewer rendering.","2024-11-11","2024-11-22","10","34","101.8","240","42%","7","User Authentication & Authorization,System Administration & Configuration,Security & Compliance,DICOM Viewer & Image Manipulation","Role-based UI visibility; Admin can create users; Audit logging for user creation; Core GPU rendering control.","Log in as Technician and show hidden Admin UI; Log in as Admin and create a new user; Show audit log entry for user creation; Demonstrate a DICOM image rendered via the new GPU control.","RBAC correctly enforced in UI; User creation flow is functional and audited; Core rendering control can display DICOMs.","RISK-001: Potential for performance issues or memory leaks in the rendering control.","Pair programming and rigorous code reviews for all DirectX code; Use GPU profiling tools.","true","frontend.dev@company.com,backend.dev@company.com,graphics.dev@company.com,fullstack.dev@company.com","","Integration of user management UI with backend services on day 6-7.","Sprint review on 2024-11-22 at 2 PM","2024-11-22","Prioritize TASK-VIEW-002 as it's the highest-effort task."
"3","Sprint 3: Session Security & DICOM Ingestion","Secure user sessions with auto-lock and enable the core DICOM data ingestion pipeline.","2024-11-25","2024-12-06","10","41","126.6","240","53%","8","User Authentication & Authorization,DICOM C-STORE SCP & Data Ingestion,DICOM Viewer & Image Manipulation,System Administration & Configuration","Automatic session lock/unlock; DICOM C-STORE SCP listener; Decoupled ingestion via RabbitMQ; Progressive image loading; Password reset functionality.","Show session locking after short inactivity period and successful unlock; Send a study from a test SCU and show it appear in the system; Open a large study and demonstrate progressive loading.","Session lock feature is functional and compliant; System can successfully receive and persist DICOM studies; Viewer performance for large studies is improved.","RISK-004: DICOM interoperability issues with test SCU; RISK-008: Data integrity between file system and DB during ingestion.","Use standard-compliant test tools (DCMTK); Design ingestion consumer to be idempotent and transactional.","true","frontend.dev@company.com,backend.dev@company.com,graphics.dev@company.com,fullstack.dev@company.com","RabbitMQ server must be available.","End-to-end DICOM ingestion testing from day 5 onwards.","Sprint review on 2024-12-06 at 2 PM","2024-12-06","Linear burndown."
"4","Sprint 4: Clinical Viewer & PACS Integration","Deliver a clinically useful viewer with essential tools and enable PACS integration.","2024-12-09","2024-12-20","10","31","106.8","240","45%","7","DICOM Viewer & Image Manipulation,DICOM Query/Retrieve (C-FIND/C-MOVE)","Interactive WW/WL, Zoom, Pan tools; PACS configuration UI; C-FIND and C-MOVE functionality.","Demonstrate all interactive viewer tools; Configure a new connection to a test PACS and verify it; Search the test PACS for studies; Retrieve a selected study to the local system.","All viewer tools are functional and performant; Users can configure and query a remote PACS; Studies can be retrieved successfully.","RISK-004: C-FIND/C-MOVE interoperability issues with the test PACS.","Implement detailed DICOM logging to debug protocol-level issues; Test against multiple open-source PACS implementations (Orthanc, dcm4che).","true","frontend.dev@company.com,backend.dev@company.com,graphics.dev@company.com,fullstack.dev@company.com","Test PACS server must be available.","End-to-end PACS Query/Retrieve testing from day 4 onwards.","Sprint review on 2024-12-20 at 2 PM","2024-12-20","Linear burndown."
"5","Sprint 5: Deployment & Operations","Create a reliable deployment and operational framework.","2025-01-06","2025-01-17","10","21","95.4","240","40%","6","Deployment & Operations,Advanced Printing, PDF Export, and Email","MSIX Installer with service registration; First-run prerequisite check wizard; Automated database backup feature; Asynchronous printing foundation.","Demonstrate a full install/uninstall on a clean VM; Show the first-run configuration wizard; Configure and trigger a manual database backup; Submit a print job and show it being processed asynchronously.","The MSIX installer provides a smooth installation experience; DB backups are successfully created; Print jobs are offloaded to the background service.","RISK-006: Deployment failures due to environmental prerequisites; MSIX custom scripting complexity.","Develop a standalone 'Environment Pre-flight Check' utility; Create exhaustive deployment documentation.","true","frontend.dev@company.com,backend.dev@company.com,fullstack.dev@company.com","Code signing certificate required for final build.","Installer testing on clean VMs from day 5 onwards.","Sprint review on 2025-01-17 at 2 PM","2025-01-17","Linear burndown."