"gate_id","gate_name","sprint","gate_type","criteria","responsible_team","gate_date","approval_required","approver","bypass_criteria","automation_level","tools_used","success_metrics"
"QG-001","Sprint 1 Quality Gate","Sprint 1","Security,Architecture","Security review of logging (PHI redaction) and database encryption (pgcrypto) passed. Architectural review of solution structure and DI setup passed. No hardcoded secrets in codebase.","QA Team,Security Lead","2024-11-01","true","tech.lead@company.com","Not bypassable.","Partially Automated","SonarQube,Manual Code Review,Integration Tests","Zero critical security vulnerabilities; All foundational ACs met."
"QG-002","Sprint 2 Quality Gate","Sprint 2","Security,Testing","All authentication scenarios (success, failure, disabled) pass E2E testing. RBAC rules correctly applied for both Admin and Technician roles across the UI. Security review of authentication logic passed.","QA Team","2024-11-15","true","tech.lead@company.com","Not bypassable.","Partially Automated","Automated E2E Tests,Manual Exploratory Testing","100% of authentication and authorization ACs met."
"QG-003","Sprint 3 Quality Gate","Sprint 3","Security,Testing","Session lock/unlock feature is fully functional and preserves application state. All specified events are correctly recorded in the audit trail. Audit trail viewer is functional.","QA Team","2024-11-29","true","tech.lead@company.com","Not bypassable.","Partially Automated","Manual Testing,Database Verification","HIPAA compliance features (session lock, audit) are validated."
"QG-004","Sprint 4 Quality Gate","Sprint 4","Integration,Testing","E2E DICOM ingestion from an external tool is successful. All user management CRUD operations are functional from the UI and correctly audited.","QA Team","2024-12-13","true","tech.lead@company.com","None.","Manual","dcmtk,Manual UI Testing","Core data input (DICOM) and management (Users) features are stable."
"QG-005","Sprint 5 Quality Gate","Sprint 5","Performance,Testing","DICOM viewer meets performance targets for image loading and manipulation. No GPU memory leaks are detected in a 30-minute test session. All core viewer tools are functional.","QA Team","2025-01-10","true","tech.lead@company.com","Not bypassable.","Manual","GPU Memory Profiler,Manual Viewer Testing","The core clinical feature of the application is usable and performant."
"QG-006","Sprint 6 Quality Gate","Sprint 6","Testing,Security","E2E password reset and forced change workflow is successful. PACS configuration UI is fully functional, including C-ECHO verification.","QA Team","2025-01-24","true","tech.lead@company.com","None.","Partially Automated","E2E Tests,Orthanc","All administrative features for user lifecycle and system configuration are complete."
"QG-007","Sprint 7 Quality Gate","Sprint 7","Integration,Testing","E2E DICOM query/retrieve workflow is successful against a test PACS. E2E asynchronous printing is functional to a virtual printer.","QA Team","2025-02-07","true","tech.lead@company.com","None.","Manual","Orthanc,Manual UI Testing","Core workflows for data interoperability (Q/R) and output (Print) are complete."
"QG-008","Sprint 8 Quality Gate","Sprint 8","Deployment,Testing","MSIX installer successfully deploys the application and service on a clean VM. First-run wizard correctly configures the application. License validation logic is confirmed to work for all states.","QA Team,DevOps","2025-02-21","true","product.owner@company.com","Not bypassable.","Manual","Clean Windows VM,Mock API Server","The application is ready for release candidate deployment."